company_id,company_name,park_name,region,industry,founded_date,employee_count,revenue_stage,ip_status,current_needs,notes
C001,上海星辰人工智能科技有限公司,漕河泾新兴技术开发区,上海/徐汇,人工智能,2021-03-15,45,初创期（<500万）,已申请专利3项；软件著作权5项,政策申报；融资对接；人才引进,"专注NLP和大模型应用开发，已有3个行业客户，团队以研发为主"
C002,上海云图数据智能有限公司,漕河泾新兴技术开发区,上海/徐汇,大数据,2019-08-20,120,成长期（500万-5000万）,已申请专利8项；软件著作权12项,政策申报；市场拓展；资质认证,"数据中台和BI解决方案提供商，服务金融和零售行业，2023年营收3200万"
C003,上海微芯半导体科技有限公司,张江高科技园区,上海/浦东,半导体,2020-06-01,85,成长期（500万-5000万）,已申请专利15项；集成电路布图6项,政策申报；产学研合作；人才引进,"模拟芯片设计企业，专注于电源管理芯片，已进入量产阶段"
C004,上海绿源生物技术有限公司,张江高科技园区,上海/浦东,生物医药,2022-01-10,30,初创期（<500万）,已申请专利2项,政策申报；投融资；实验室资源,"新型抗体药物研发企业，目前有2个临床前管线，团队来自知名药企"
C005,上海智行者机器人有限公司,上海机器人产业园,上海/宝山,智能制造,2018-11-01,200,成熟期（>5000万）,已申请专利22项；软件著作权8项,政策申报；产业链对接；海外市场,"工业协作机器人研发和制造企业，2023年营收1.2亿，产品已出口东南亚"
C006,上海青藤文化创意有限公司,徐汇滨江创意园区,上海/徐汇,文化创意,2023-03-01,15,初创期（<500万）,软件著作权3项,政策申报；场地补贴；创业指导,"数字文创企业，专注AI辅助设计工具开发，团队年轻有活力"
C007,上海云帆物联网科技有限公司,上海机器人产业园,上海/宝山,物联网,2021-09-15,55,成长期（500万-5000万）,已申请专利5项；软件著作权7项,政策申报；技术合作；人才招聘,"工业物联网解决方案提供商，服务于制造业数字化转型"
C008,上海深蓝医疗器械有限公司,张江高科技园区,上海/浦东,医疗器械,2017-04-01,150,成长期（500万-5000万）,已申请专利18项；医疗器械注册证3项,政策申报；临床资源；市场拓展,"微创手术器械研发制造，2023年营收4800万，处于快速扩张期"
